{
  "source": {
    "kind": "json",
    "path": "control-center.source.json",
    "sha256": "fc58826722d3a31d623426c4eaa1f827066d64a8f18e637b430e79ec97f4c6ab"
  },
  "decisionState": {
    "mode": "no_score",
    "signals": [
      {"metric":"mrr","label":"MRR","value":"$177,378","delta":"+1.5%","direction":"improving","provenance":"source"},
      {"metric":"net_revenue","label":"Net Revenue","value":"$164,889","delta":"+11.7%","direction":"improving","provenance":"source"},
      {"metric":"mrr_growth","label":"MRR Growth","value":"1.50%","delta":"+247.6%","direction":"improving","provenance":"source"},
      {"metric":"user_churn","label":"User Churn","value":"2.50%","delta":"-47.8%","direction":"improving","provenance":"source"},
      {"metric":"quick_ratio","label":"Quick Ratio","value":"1.51","delta":"+79.8%","direction":"improving","provenance":"source"},
      {"metric":"active_customers","label":"Active Customers","value":"947","delta":"+1.2%","direction":"improving","provenance":"source"}
    ],
    "breakdown": [
      {"label":"New trials","value":"4","provenance":"source"},
      {"label":"New customer","value":"1","delta":"+$50.00","direction":"improving","provenance":"source"},
      {"label":"Expansions","value":"2","delta":"+$65.94","direction":"improving","provenance":"source"},
      {"label":"Total change","value":"+$115.94","direction":"improving","provenance":"source"}
    ],
    "events": [
      {"subject":"That Person","event":"Paid $189","time":"2h ago","provenance":"source"},
      {"subject":"Another Guy","event":"Signed up","time":"2h ago","provenance":"source"},
      {"subject":"Awesome Company","event":"Refunded $189","time":"2h ago","provenance":"source"},
      {"subject":"That Person","event":"Paid $299.40","time":"6h ago","provenance":"source"}
    ]
  },
  "evidence": [
    {"id":"ev_001","anchor":{"type":"json_pointer","pointer":"/signals/0/label"}},
    {"id":"ev_002","anchor":{"type":"json_pointer","pointer":"/signals/0/value"}},
    {"id":"ev_003","anchor":{"type":"json_pointer","pointer":"/signals/0/delta"}},
    {"id":"ev_004","anchor":{"type":"json_pointer","pointer":"/signals/0/direction"}},
    {"id":"ev_005","anchor":{"type":"json_pointer","pointer":"/signals/1/label"}},
    {"id":"ev_006","anchor":{"type":"json_pointer","pointer":"/signals/1/value"}},
    {"id":"ev_007","anchor":{"type":"json_pointer","pointer":"/signals/1/delta"}},
    {"id":"ev_008","anchor":{"type":"json_pointer","pointer":"/signals/1/direction"}},
    {"id":"ev_009","anchor":{"type":"json_pointer","pointer":"/signals/2/label"}},
    {"id":"ev_010","anchor":{"type":"json_pointer","pointer":"/signals/2/value"}},
    {"id":"ev_011","anchor":{"type":"json_pointer","pointer":"/signals/2/delta"}},
    {"id":"ev_012","anchor":{"type":"json_pointer","pointer":"/signals/2/direction"}},
    {"id":"ev_013","anchor":{"type":"json_pointer","pointer":"/signals/3/label"}},
    {"id":"ev_014","anchor":{"type":"json_pointer","pointer":"/signals/3/value"}},
    {"id":"ev_015","anchor":{"type":"json_pointer","pointer":"/signals/3/delta"}},
    {"id":"ev_016","anchor":{"type":"json_pointer","pointer":"/signals/3/direction"}},
    {"id":"ev_017","anchor":{"type":"json_pointer","pointer":"/signals/4/label"}},
    {"id":"ev_018","anchor":{"type":"json_pointer","pointer":"/signals/4/value"}},
    {"id":"ev_019","anchor":{"type":"json_pointer","pointer":"/signals/4/delta"}},
    {"id":"ev_020","anchor":{"type":"json_pointer","pointer":"/signals/4/direction"}},
    {"id":"ev_021","anchor":{"type":"json_pointer","pointer":"/signals/5/label"}},
    {"id":"ev_022","anchor":{"type":"json_pointer","pointer":"/signals/5/value"}},
    {"id":"ev_023","anchor":{"type":"json_pointer","pointer":"/signals/5/delta"}},
    {"id":"ev_024","anchor":{"type":"json_pointer","pointer":"/signals/5/direction"}},
    {"id":"ev_025","anchor":{"type":"json_pointer","pointer":"/breakdown/0/label"}},
    {"id":"ev_026","anchor":{"type":"json_pointer","pointer":"/breakdown/0/value"}},
    {"id":"ev_027","anchor":{"type":"json_pointer","pointer":"/breakdown/1/label"}},
    {"id":"ev_028","anchor":{"type":"json_pointer","pointer":"/breakdown/1/value"}},
    {"id":"ev_029","anchor":{"type":"json_pointer","pointer":"/breakdown/1/delta"}},
    {"id":"ev_030","anchor":{"type":"json_pointer","pointer":"/breakdown/1/direction"}},
    {"id":"ev_031","anchor":{"type":"json_pointer","pointer":"/breakdown/2/label"}},
    {"id":"ev_032","anchor":{"type":"json_pointer","pointer":"/breakdown/2/value"}},
    {"id":"ev_033","anchor":{"type":"json_pointer","pointer":"/breakdown/2/delta"}},
    {"id":"ev_034","anchor":{"type":"json_pointer","pointer":"/breakdown/2/direction"}},
    {"id":"ev_035","anchor":{"type":"json_pointer","pointer":"/breakdown/3/label"}},
    {"id":"ev_036","anchor":{"type":"json_pointer","pointer":"/breakdown/3/value"}},
    {"id":"ev_037","anchor":{"type":"json_pointer","pointer":"/breakdown/3/direction"}},
    {"id":"ev_038","anchor":{"type":"json_pointer","pointer":"/events/0/subject"}},
    {"id":"ev_039","anchor":{"type":"json_pointer","pointer":"/events/0/event"}},
    {"id":"ev_040","anchor":{"type":"json_pointer","pointer":"/events/0/time"}},
    {"id":"ev_041","anchor":{"type":"json_pointer","pointer":"/events/1/subject"}},
    {"id":"ev_042","anchor":{"type":"json_pointer","pointer":"/events/1/event"}},
    {"id":"ev_043","anchor":{"type":"json_pointer","pointer":"/events/1/time"}},
    {"id":"ev_044","anchor":{"type":"json_pointer","pointer":"/events/2/subject"}},
    {"id":"ev_045","anchor":{"type":"json_pointer","pointer":"/events/2/event"}},
    {"id":"ev_046","anchor":{"type":"json_pointer","pointer":"/events/2/time"}},
    {"id":"ev_047","anchor":{"type":"json_pointer","pointer":"/events/3/subject"}},
    {"id":"ev_048","anchor":{"type":"json_pointer","pointer":"/events/3/event"}},
    {"id":"ev_049","anchor":{"type":"json_pointer","pointer":"/events/3/time"}}
  ],
  "claims": [
    {"decisionPath":"/signals/0/label","evidenceRef":"ev_001"},
    {"decisionPath":"/signals/0/value","evidenceRef":"ev_002"},
    {"decisionPath":"/signals/0/delta","evidenceRef":"ev_003"},
    {"decisionPath":"/signals/0/direction","evidenceRef":"ev_004"},
    {"decisionPath":"/signals/1/label","evidenceRef":"ev_005"},
    {"decisionPath":"/signals/1/value","evidenceRef":"ev_006"},
    {"decisionPath":"/signals/1/delta","evidenceRef":"ev_007"},
    {"decisionPath":"/signals/1/direction","evidenceRef":"ev_008"},
    {"decisionPath":"/signals/2/label","evidenceRef":"ev_009"},
    {"decisionPath":"/signals/2/value","evidenceRef":"ev_010"},
    {"decisionPath":"/signals/2/delta","evidenceRef":"ev_011"},
    {"decisionPath":"/signals/2/direction","evidenceRef":"ev_012"},
    {"decisionPath":"/signals/3/label","evidenceRef":"ev_013"},
    {"decisionPath":"/signals/3/value","evidenceRef":"ev_014"},
    {"decisionPath":"/signals/3/delta","evidenceRef":"ev_015"},
    {"decisionPath":"/signals/3/direction","evidenceRef":"ev_016"},
    {"decisionPath":"/signals/4/label","evidenceRef":"ev_017"},
    {"decisionPath":"/signals/4/value","evidenceRef":"ev_018"},
    {"decisionPath":"/signals/4/delta","evidenceRef":"ev_019"},
    {"decisionPath":"/signals/4/direction","evidenceRef":"ev_020"},
    {"decisionPath":"/signals/5/label","evidenceRef":"ev_021"},
    {"decisionPath":"/signals/5/value","evidenceRef":"ev_022"},
    {"decisionPath":"/signals/5/delta","evidenceRef":"ev_023"},
    {"decisionPath":"/signals/5/direction","evidenceRef":"ev_024"},
    {"decisionPath":"/breakdown/0/label","evidenceRef":"ev_025"},
    {"decisionPath":"/breakdown/0/value","evidenceRef":"ev_026"},
    {"decisionPath":"/breakdown/1/label","evidenceRef":"ev_027"},
    {"decisionPath":"/breakdown/1/value","evidenceRef":"ev_028"},
    {"decisionPath":"/breakdown/1/delta","evidenceRef":"ev_029"},
    {"decisionPath":"/breakdown/1/direction","evidenceRef":"ev_030"},
    {"decisionPath":"/breakdown/2/label","evidenceRef":"ev_031"},
    {"decisionPath":"/breakdown/2/value","evidenceRef":"ev_032"},
    {"decisionPath":"/breakdown/2/delta","evidenceRef":"ev_033"},
    {"decisionPath":"/breakdown/2/direction","evidenceRef":"ev_034"},
    {"decisionPath":"/breakdown/3/label","evidenceRef":"ev_035"},
    {"decisionPath":"/breakdown/3/value","evidenceRef":"ev_036"},
    {"decisionPath":"/breakdown/3/direction","evidenceRef":"ev_037"},
    {"decisionPath":"/events/0/subject","evidenceRef":"ev_038"},
    {"decisionPath":"/events/0/event","evidenceRef":"ev_039"},
    {"decisionPath":"/events/0/time","evidenceRef":"ev_040"},
    {"decisionPath":"/events/1/subject","evidenceRef":"ev_041"},
    {"decisionPath":"/events/1/event","evidenceRef":"ev_042"},
    {"decisionPath":"/events/1/time","evidenceRef":"ev_043"},
    {"decisionPath":"/events/2/subject","evidenceRef":"ev_044"},
    {"decisionPath":"/events/2/event","evidenceRef":"ev_045"},
    {"decisionPath":"/events/2/time","evidenceRef":"ev_046"},
    {"decisionPath":"/events/3/subject","evidenceRef":"ev_047"},
    {"decisionPath":"/events/3/event","evidenceRef":"ev_048"},
    {"decisionPath":"/events/3/time","evidenceRef":"ev_049"}
  ]
}
